{
  "$schema": "http://json-schema.org/draft-07/schema#",
  "$id": "https://ahliweb.com/schemas/omes/agent-deployment/v1",
  "title": "OMES AgentDeployment manifest v1",
  "description": "Versioned schema for the native OMES + Hermes + systemd agent deployment manifest (issue #87). Field names mirror the illustrative manifest in docs/agent-orchestration-roadmap.md section 4. Validated by lib/omes/py/agent/manifest.py's stdlib validator, not scripts/check-contracts.py (that script belongs to a different contract area).",
  "type": "object",
  "required": ["apiVersion", "kind", "metadata", "spec"],
  "additionalProperties": false,
  "properties": {
    "apiVersion": { "const": "omes.ahliweb.com/v1" },
    "kind": { "const": "AgentDeployment" },
    "metadata": {
      "type": "object",
      "required": ["name", "workspace", "environment"],
      "additionalProperties": false,
      "properties": {
        "name": {
          "type": "string",
          "pattern": "^[a-z][a-z0-9-]{1,31}$",
          "description": "Stable logical agent name. Also used to derive the systemd unit name (omes-agent-<name>.service) and the HERMES_HOME isolation path, so it is restricted to a safe, unambiguous character set."
        },
        "workspace": { "type": "string", "minLength": 1, "maxLength": 64 },
        "environment": { "type": "string", "enum": ["production", "staging", "development"] }
      }
    },
    "spec": {
      "type": "object",
      "required": [
        "runtime",
        "profile",
        "role",
        "backend",
        "serviceMode",
        "restartPolicy",
        "resources",
        "health",
        "storage"
      ],
      "additionalProperties": false,
      "properties": {
        "runtime": {
          "type": "string",
          "enum": ["hermes"],
          "description": "MVP supports only 'hermes' (issue #87 acceptance criterion); any other value must fail preflight before mutation."
        },
        "profile": {
          "type": "string",
          "pattern": "^[a-z][a-z0-9-]{0,63}$",
          "description": "Hermes profile name; used to derive the agent's isolated HERMES_HOME, never a shared one."
        },
        "role": { "type": "string", "enum": ["generic", "specialist"] },
        "backend": {
          "type": "string",
          "enum": ["systemd", "compose"],
          "description": "'systemd' is the MVP backend (issue #87). 'compose' is the rootless Docker Compose isolation backend (issue #96, docs/agent-orchestration-roadmap.md section 2.2); when set, 'spec.compose' is required (enforced in lib/omes/py/agent/manifest.py, since this stdlib schema engine has no conditional-required keyword)."
        },
        "serviceMode": { "type": "string", "enum": ["user", "system"] },
        "restartPolicy": { "type": "string", "enum": ["always", "on-failure", "no"] },
        "capabilities": {
          "type": "array",
          "items": { "type": "string", "minLength": 1, "maxLength": 128 }
        },
        "deny": {
          "type": "array",
          "items": { "type": "string", "minLength": 1, "maxLength": 128 }
        },
        "resources": {
          "type": "object",
          "required": ["memory", "cpu", "pids"],
          "additionalProperties": false,
          "properties": {
            "memory": {
              "type": "string",
              "pattern": "^[0-9]+[KMG]$",
              "description": "systemd MemoryMax=/MemoryHigh= value, e.g. '1G'."
            },
            "cpu": {
              "type": "string",
              "pattern": "^[0-9]+(\\.[0-9]+)?$",
              "description": "CPU quota expressed as core-count, rendered into systemd CPUQuota= (e.g. '1.0' -> '100%')."
            },
            "pids": { "type": "integer", "minimum": 1, "maximum": 100000 }
          }
        },
        "health": {
          "type": "object",
          "required": ["command", "timeout"],
          "additionalProperties": false,
          "properties": {
            "command": { "type": "string", "minLength": 1, "maxLength": 512 },
            "timeout": {
              "type": "string",
              "pattern": "^[0-9]+s$",
              "description": "Bounded health-check timeout, seconds, e.g. '10s'."
            }
          }
        },
        "storage": {
          "type": "object",
          "required": ["memory", "sessions", "skills"],
          "additionalProperties": false,
          "properties": {
            "memory": { "type": "string", "enum": ["private", "shared"] },
            "sessions": { "type": "string", "enum": ["isolated", "shared"] },
            "skills": { "type": "string", "enum": ["managed", "shared"] }
          }
        },
        "secrets": {
          "type": "array",
          "description": "Secret REFERENCES only (env var / secret-store key names). Never a value.",
          "items": {
            "type": "string",
            "pattern": "^[A-Za-z_][A-Za-z0-9_-]{0,127}$"
          }
        },
        "compose": {
          "type": "object",
          "description": "Required when spec.backend is 'compose' (issue #96). Rootless Docker Compose isolation for one agent deployment. Never grants Docker socket access to the agent container; see lib/omes/py/agent/compose.py for the full validation this schema alone cannot express (digest-only images, host-path containment under the agent's own state dir, no privileged/host-PID/host-network, localhost-only port binds).",
          "additionalProperties": false,
          "required": ["image"],
          "properties": {
            "topology": {
              "type": "string",
              "enum": ["shared", "dedicated"],
              "description": "Container topology ('shared' or 'dedicated'). Defaults to 'dedicated' for v1 backward compatibility."
            },
            "image": {
              "type": "string",
              "minLength": 1,
              "maxLength": 512,
              "pattern": "^[a-zA-Z0-9][a-zA-Z0-9._/-]*@sha256:[0-9a-f]{64}$",
              "description": "Must be pinned by digest (@sha256:<64 hex>). A tag-only reference (e.g. ':latest') is rejected."
            },
            "project": {
              "type": "string",
              "pattern": "^[a-z][a-z0-9_-]{0,63}$",
              "description": "Compose project name (-p). Defaults to 'omes-agent-<name>' when omitted."
            },
            "network": {
              "type": "string",
              "pattern": "^[a-z][a-z0-9_-]{0,63}$",
              "description": "Isolated per-agent Docker network name. Defaults to 'omes-agent-<name>-net'. The literal value 'host' is rejected in lib/omes/py/agent/compose.py even though it would match this pattern."
            },
            "user": {
              "type": "string",
              "pattern": "^[1-9][0-9]*:[1-9][0-9]*$",
              "description": "Non-root 'uid:gid' the container runs as. uid 0 and gid 0 are both rejected."
            },
            "capDrop": {
              "type": "array",
              "items": { "type": "string", "pattern": "^[A-Z_]+$" },
              "description": "Defaults to ['ALL'] when omitted. lib/omes/py/agent/compose.py rejects any value other than exactly ['ALL'] - this backend never re-adds capabilities."
            },
            "readOnlyRootfs": {
              "type": "boolean",
              "description": "Defaults to true when omitted."
            },
            "egress": {
              "type": "string",
              "enum": ["open", "none"],
              "description": "Network egress mode (issue #276). 'open' (default when omitted) renders the compose network as a plain bridge with outbound access, exactly as before. 'none' renders it with 'internal: true' so Docker gives the network no route to the outside world; this is all-or-nothing (no per-destination allowlist) and cannot be combined with 'ports'."
            },
            "volumes": {
              "type": "array",
              "items": {
                "type": "object",
                "additionalProperties": false,
                "required": ["hostPath", "containerPath"],
                "properties": {
                  "hostPath": {
                    "type": "string",
                    "minLength": 1,
                    "maxLength": 4096,
                    "description": "Must resolve under this agent's own OMES-managed state directory; must not contain ':' (blocks smuggling extra bind-mount flags such as ':Z') and must not reference /var/run/docker.sock."
                  },
                  "containerPath": {
                    "type": "string",
                    "minLength": 1,
                    "maxLength": 4096,
                    "pattern": "^/[^:]*$"
                  },
                  "readOnly": { "type": "boolean" }
                }
              }
            },
            "ports": {
              "type": "array",
              "description": "Empty by default. Only loopback binds are allowed.",
              "items": {
                "type": "string",
                "pattern": "^127\\.0\\.0\\.1:[0-9]{1,5}:[0-9]{1,5}$"
              }
            }
          }
        }
      }
    }
  }
}
