{
  "apiVersion": "omes.ahliweb.com/v1",
  "kind": "AgentDeployment",
  "metadata": {
    "name": "compose-worker",
    "workspace": "ahliweb",
    "environment": "staging"
  },
  "spec": {
    "runtime": "hermes",
    "profile": "compose-worker",
    "role": "generic",
    "backend": "compose",
    "serviceMode": "user",
    "restartPolicy": "on-failure",
    "capabilities": ["web-search"],
    "deny": ["docker-control", "firewall-write"],
    "resources": {
      "memory": "512M",
      "cpu": "0.5",
      "pids": 64
    },
    "health": {
      "command": "omes agent health compose-worker",
      "timeout": "10s"
    },
    "storage": {
      "memory": "private",
      "sessions": "isolated",
      "skills": "managed"
    },
    "secrets": ["provider-primary"],
    "compose": {
      "image": "registry.example.com/agents/compose-worker@sha256:aaaaaaaaaaaaaaaaaaaaaaaaaaaaaaaaaaaaaaaaaaaaaaaaaaaaaaaaaaaaaaaa",
      "project": "omes-agent-compose-worker",
      "network": "omes-agent-compose-worker-net",
      "user": "1000:1000",
      "capDrop": ["ALL"],
      "readOnlyRootfs": true,
      "ports": ["127.0.0.1:8081:8080"]
    }
  }
}
